{
 "schema_version": 1,
 "slice_id": "calc.media.v1",
 "mode": "lite",
 "goal": "Fix media() so that the empty list is rejected with ValueError, without changing the signature or the docs module.",
 "invariants": [],
 "non_goals": ["renombrar media()"],
 "criticality": "low",
 "budget": { "max_cost_usd": null, "max_inner_iterations": 5, "max_tier1_adversarial_rounds": 2, "max_mutants": null },
 "critical_paths": [],
 "acceptance": ["media([]) lanza ValueError"],
 "boundary": { "forbidden_paths": ["docs/**"], "do_not_refactor": ["media"] }
}
